{
  "schemaVersion": 1,
  "contractRevision": "ar-c0-c0dc683e-r3",
  "status": "frozen-c0-only",
  "source": {
    "repository": "agent-teams-ai/agent-runtime",
    "commit": "c0dc683ecb14760c75a69283ad7ec312f6246a63",
    "tree": "54a5f3755c4f93335e240a8ce8bdf1c55af5bb89",
    "detached": false,
    "planPath": "architecture/c0/ar-owned-lifetime/evidence/sdk-and-owned-lifetime-implementation-plan.md",
    "planSha256": "e025978dcf3cfac12b7795fa3aafc96f06838620e124df4cc091ebee45352864",
    "qualityStandardPath": "architecture/c0/ar-owned-lifetime/evidence/engineering-quality-standard.md",
    "qualityStandardSha256": "8346f1a448f2c1afc0ee7b0aded338d1894f893c763836a17b79422515077d8b",
    "planReview": {
      "result": "go",
      "observedSha256": "e025978dcf3cfac12b7795fa3aafc96f06838620e124df4cc091ebee45352864",
      "requiredBytesRead": true,
      "reason": "Exact final e025978d bytes supplied during continuation and reviewed, including section 4 go/blocked matrix, S3 external anchor, sections 6-7 transition/retention/handoff/wait constraints and delivery DAG. Earlier ef336219 input is superseded."
    }
  },
  "allowedConsumers": [
    "AR C0 validation and orchestrator review",
    "EF S1 surface-matrix input (AR facts only)",
    "AR A3 SDK planning (activation pending)"
  ],
  "prohibitions": [
    "production runtime changes",
    "new ownership package or lifecycle state machine",
    "SDK analyzer implementation",
    "public exports/dependency/lock/workflow changes",
    "pending adoption activation",
    "live provider/auth/agent/project experiments",
    "applying old-ar-c0.preserved.patch"
  ],
  "repositoryReferences": {
    "AR": "be96f01ea54ec7d2ec0156774e3dfb75fac46803",
    "GM": "ac49bb3374946330ec820591f8195a22d2c90900",
    "EF": "eadd117f98e8b93318426ab9d77d5890aab2e15e",
    "XF": "6379c8d3be3b9946f9ef1dc168cb8272dd726078",
    "authority": "Exact historical plan inputs, not current integration bases. AR source.commit identifies the rebased source inventory; the retained plan remains byte-identical. Other repositories keep separately authoritative C0 artifacts; no copied API or SDK envelope."
  },
  "cms": {
    "activeProfile": "architecture/get-modular/consumer-profile.json",
    "before": {
      "repository": "agent-teams-ai/get-modular",
      "path": "docs/architecture/common-assembly.md",
      "anchor": "consumer-module-standard",
      "decision": "ADR-0026",
      "commit": "669a750d8db451e04f075cdeb36576c6606fba6e",
      "sha256": "e6cd8d26b4317bf5f94ddd22f6e36bf25e90548f72265d94808eaf20b947e553",
      "evidencePath": "architecture/get-modular/evidence/consumer-module-standard.md"
    },
    "after": {
      "commit": "ac49bb3374946330ec820591f8195a22d2c90900",
      "path": "docs/architecture/common-assembly.md",
      "evidencePath": "architecture/c0/ar-owned-lifetime/evidence/common-assembly-ac49bb33.md",
      "sha256": "d5bb71e5a700014f9f0a09b17d1f33d24b30b66c49b273c9fb65584672c51e4f"
    },
    "deltaPath": "architecture/c0/ar-owned-lifetime/evidence/cms-delta.diff",
    "deltaSha256": "9bcc228419f21a0fb88e3d2e13a667730831f8401821833e31d6187e45ba2990",
    "fullDocumentBytesEqual": false,
    "normativeContractDelta": "no-op: only reciprocal AR PR 168 adoption reference replaces planned-consumer paragraph; requirements, API, ownership and rejecting gates unchanged",
    "review": "Complete 358-line retained and 363-line supplied upstream documents read and compared, including execution/Promise, returned-product custody, and acceptance sections. No shared behavior changed in this C0. Historical ordinary-session-pin-review is not active authority. Rebased checkpoint 1d9a082 on c0dc683 rechecks the same complete-document pins and delta; active standard remains 669a750d. Source changes retain the C0 ownership, wait and recovery blockers.",
    "upstreamFreshness": "observed: upstream main 610e595fe1f2e893d01ee44ceecd6349b5a3c8ce on 2026-09-16; exact common-assembly.md SHA-256 d5bb71e5a700014f9f0a09b17d1f33d24b30b66c49b273c9fb65584672c51e4f equals retained ac49bb33 bytes. Active 669a750d pin migration remains pending; no adoption activation.",
    "migration": "pending for later owning adoption PR: current upstream 610e595f complete-document bytes match reviewed ac49bb33 evidence; migrate active pin/evidence and rejecting checks together. Existing active scoped adoption stays at 669a750d; no new ownership adoption."
  },
  "inventory": {
    "packages": [
      {
        "manifest": "package.json",
        "sha256": "fa9aebb0128662e461744e4617c65c9ee03f830abde54f4732584bb42868697d",
        "name": "@vioxen/agent-runtime",
        "version": "0.0.0",
        "private": true,
        "classification": "private-tooling-root-no-supported-sdk",
        "exports": null,
        "files": [],
        "main": null,
        "types": null,
        "bin": null,
        "branches": [],
        "activation": "pending",
        "notes": "No exports map on private unpublished root: no full-SDK or deep-import coverage claim."
      },
      {
        "manifest": "packages/apps/embedded-runtime/package.json",
        "sha256": "d654e30e7d002af040e880ad3a7d1430e07f055318ff594023049bb65d2cf7af",
        "name": "@agent-teams/embedded-runtime",
        "version": "0.0.0",
        "private": true,
        "classification": "private-package-with-governed-development-entrypoints",
        "exports": {
          ".": {
            "types": "./dist/index.d.ts",
            "import": "./dist/index.js"
          },
          "./composition": {
            "types": "./dist/composition.d.ts",
            "import": "./dist/composition.js"
          },
          "./scripts/run-package-tests.mjs": "./scripts/run-package-tests.mjs"
        },
        "files": [
          "dist"
        ],
        "main": null,
        "types": null,
        "bin": null,
        "branches": [
          {
            "subpath": ".",
            "shape": "ordered-types-import",
            "resolutionTree": {
              "types": "./dist/index.d.ts",
              "import": "./dist/index.js"
            },
            "observer": "EF existing API Extractor for declarations; S1 ordered branch observer required",
            "coverage": "incomplete"
          },
          {
            "subpath": "./composition",
            "shape": "ordered-types-import",
            "resolutionTree": {
              "types": "./dist/composition.d.ts",
              "import": "./dist/composition.js"
            },
            "observer": "EF existing API Extractor for declarations; S1 ordered branch observer required",
            "coverage": "incomplete"
          },
          {
            "subpath": "./scripts/run-package-tests.mjs",
            "shape": "static-esm-file",
            "resolutionTree": "./scripts/run-package-tests.mjs",
            "observer": "EF static runtime export observation; positive fixture and packed membership not verified in AR C0",
            "coverage": "incomplete"
          }
        ],
        "activation": "pending",
        "notes": "Private flag does not erase importable development obligations; packed artifact and observer fixture coverage remain A3/EF obligations."
      },
      {
        "manifest": "packages/contexts/agent-execution/package.json",
        "sha256": "c4b74da6c503d5f35b68cb03308c241accb00f05a38e2485571a8a4ee29c6143",
        "name": "@agent-teams/agent-execution",
        "version": "0.0.0",
        "private": true,
        "classification": "private-package-with-governed-development-entrypoints",
        "exports": {
          ".": {
            "types": "./dist/index.d.ts",
            "import": "./dist/index.js"
          },
          "./composition": {
            "types": "./dist/composition.d.ts",
            "import": "./dist/composition.js"
          }
        },
        "files": [
          "dist"
        ],
        "main": null,
        "types": null,
        "bin": null,
        "branches": [
          {
            "subpath": ".",
            "shape": "ordered-types-import",
            "resolutionTree": {
              "types": "./dist/index.d.ts",
              "import": "./dist/index.js"
            },
            "observer": "EF existing API Extractor for declarations; S1 ordered branch observer required",
            "coverage": "incomplete"
          },
          {
            "subpath": "./composition",
            "shape": "ordered-types-import",
            "resolutionTree": {
              "types": "./dist/composition.d.ts",
              "import": "./dist/composition.js"
            },
            "observer": "EF existing API Extractor for declarations; S1 ordered branch observer required",
            "coverage": "incomplete"
          }
        ],
        "activation": "pending",
        "notes": "Private flag does not erase importable development obligations; packed artifact and observer fixture coverage remain A3/EF obligations."
      },
      {
        "manifest": "packages/contexts/provider-access/package.json",
        "sha256": "16f99b9c4468594593d55c2554660b298923f4344312895fe30cc9d0c3969c59",
        "name": "@agent-teams/provider-access",
        "version": "0.0.0",
        "private": true,
        "classification": "private-package-with-governed-development-entrypoints",
        "exports": {
          ".": {
            "types": "./dist/index.d.ts",
            "import": "./dist/index.js"
          },
          "./composition": {
            "types": "./dist/composition.d.ts",
            "import": "./dist/composition.js"
          }
        },
        "files": [
          "dist"
        ],
        "main": null,
        "types": null,
        "bin": null,
        "branches": [
          {
            "subpath": ".",
            "shape": "ordered-types-import",
            "resolutionTree": {
              "types": "./dist/index.d.ts",
              "import": "./dist/index.js"
            },